[
  {
    "id": "equip.shield_218",
    "name": "equip.shield_218.name",
    "slot": "support",
    "icon": "icon:item/shield_218",
    "stats": {
      "defense": 400,
      "hp": 300
    },
    "shop": {
      "currency": "currency.gem",
      "price": 100,
      "listed": true
    }
  },
  {
    "id": "equip.shield_219",
    "name": "equip.shield_219.name",
    "slot": "support",
    "icon": "icon:item/shield_219",
    "stats": {
      "defense": 410,
      "hp": 310
    },
    "shop": {
      "currency": "currency.gem",
      "price": 100,
      "listed": true
    }
  },
  {
    "id": "equip.shield_220",
    "name": "equip.shield_220.name",
    "slot": "support",
    "icon": "icon:item/shield_220",
    "stats": {
      "defense": 420,
      "hp": 320,
      "speed": -30
    },
    "shop": {
      "currency": "currency.gem",
      "price": 100,
      "listed": true
    }
  },
  {
    "id": "equip.shield_221",
    "name": "equip.shield_221.name",
    "slot": "support",
    "icon": "icon:item/shield_221",
    "stats": {
      "defense": 430,
      "hp": 330
    },
    "shop": {
      "currency": "currency.gem",
      "price": 100,
      "listed": true
    }
  },
  {
    "id": "equip.shield_222",
    "name": "equip.shield_222.name",
    "slot": "support",
    "icon": "icon:item/shield_222",
    "stats": {
      "defense": 440,
      "hp": 340
    },
    "shop": {
      "currency": "currency.gem",
      "price": 100,
      "listed": true
    }
  },
  {
    "id": "equip.shield_223",
    "name": "equip.shield_223.name",
    "slot": "support",
    "icon": "icon:item/shield_223",
    "stats": {
      "defense": 450,
      "hp": 350,
      "speed": -33
    },
    "shop": {
      "currency": "currency.gem",
      "price": 100,
      "listed": true
    }
  },
  {
    "id": "equip.shield_233",
    "name": "equip.shield_233.name",
    "slot": "support",
    "icon": "icon:item/shield_233",
    "stats": {
      "defense": 470,
      "hp": 370
    },
    "shop": {
      "currency": "currency.gem",
      "price": 100,
      "listed": true
    }
  },
  {
    "id": "equip.shield_234",
    "name": "equip.shield_234.name",
    "slot": "support",
    "icon": "icon:item/shield_234",
    "stats": {
      "defense": 480,
      "hp": 380
    },
    "shop": {
      "currency": "currency.gem",
      "price": 100,
      "listed": true
    }
  },
  {
    "id": "equip.shield_235",
    "name": "equip.shield_235.name",
    "slot": "support",
    "icon": "icon:item/shield_235",
    "stats": {
      "defense": 490,
      "hp": 390,
      "speed": -36
    },
    "shop": {
      "currency": "currency.gem",
      "price": 100,
      "listed": true
    }
  },
  {
    "id": "equip.shield_236",
    "name": "equip.shield_236.name",
    "slot": "support",
    "icon": "icon:item/shield_236",
    "stats": {
      "defense": 500,
      "hp": 400
    },
    "shop": {
      "currency": "currency.gem",
      "price": 100,
      "listed": true
    }
  },
  {
    "id": "equip.shield_237",
    "name": "equip.shield_237.name",
    "slot": "support",
    "icon": "icon:item/shield_237",
    "stats": {
      "defense": 510,
      "hp": 410
    },
    "shop": {
      "currency": "currency.gem",
      "price": 100,
      "listed": true
    }
  },
  {
    "id": "equip.shield_238",
    "name": "equip.shield_238.name",
    "slot": "support",
    "icon": "icon:item/shield_238",
    "stats": {
      "defense": 520,
      "hp": 420,
      "speed": -39
    },
    "shop": {
      "currency": "currency.gem",
      "price": 100,
      "listed": true
    }
  },
  {
    "id": "equip.cloak_278",
    "name": "equip.cloak_278.name",
    "slot": "support",
    "icon": "icon:item/cloak_278",
    "stats": {
      "speed": 75,
      "defense": 150,
      "hp": 200
    },
    "shop": {
      "currency": "currency.gem",
      "price": 100,
      "listed": true
    }
  },
  {
    "id": "equip.cloak_279",
    "name": "equip.cloak_279.name",
    "slot": "support",
    "icon": "icon:item/cloak_279",
    "stats": {
      "speed": 78,
      "defense": 160
    },
    "shop": {
      "currency": "currency.gem",
      "price": 100,
      "listed": true
    }
  },
  {
    "id": "equip.cloak_280",
    "name": "equip.cloak_280.name",
    "slot": "support",
    "icon": "icon:item/cloak_280",
    "stats": {
      "speed": 81,
      "defense": 170,
      "hp": 220
    },
    "shop": {
      "currency": "currency.gem",
      "price": 100,
      "listed": true
    }
  },
  {
    "id": "equip.cloak_281",
    "name": "equip.cloak_281.name",
    "slot": "support",
    "icon": "icon:item/cloak_281",
    "stats": {
      "speed": 84,
      "defense": 180
    },
    "shop": {
      "currency": "currency.gem",
      "price": 100,
      "listed": true
    }
  },
  {
    "id": "equip.cloak_282",
    "name": "equip.cloak_282.name",
    "slot": "support",
    "icon": "icon:item/cloak_282",
    "stats": {
      "speed": 87,
      "defense": 190,
      "hp": 240
    },
    "shop": {
      "currency": "currency.gem",
      "price": 100,
      "listed": true
    }
  },
  {
    "id": "equip.cloak_283",
    "name": "equip.cloak_283.name",
    "slot": "support",
    "icon": "icon:item/cloak_283",
    "stats": {
      "speed": 90,
      "defense": 200
    },
    "shop": {
      "currency": "currency.gem",
      "price": 100,
      "listed": true
    }
  },
  {
    "id": "equip.cloak_284",
    "name": "equip.cloak_284.name",
    "slot": "support",
    "icon": "icon:item/cloak_284",
    "stats": {
      "speed": 93,
      "defense": 210,
      "hp": 260
    },
    "shop": {
      "currency": "currency.gem",
      "price": 100,
      "listed": true
    }
  },
  {
    "id": "equip.book_248",
    "name": "equip.book_248.name",
    "slot": "support",
    "icon": "icon:item/book_248",
    "stats": {
      "effectHit": 300,
      "attack": 200
    },
    "shop": {
      "currency": "currency.gem",
      "price": 100,
      "listed": true
    }
  },
  {
    "id": "equip.book_249",
    "name": "equip.book_249.name",
    "slot": "support",
    "icon": "icon:item/book_249",
    "stats": {
      "effectHit": 310,
      "attack": 210
    },
    "shop": {
      "currency": "currency.gem",
      "price": 100,
      "listed": true
    }
  },
  {
    "id": "equip.book_250",
    "name": "equip.book_250.name",
    "slot": "support",
    "icon": "icon:item/book_250",
    "stats": {
      "effectHit": 320,
      "attack": 220,
      "critRate": 200
    },
    "shop": {
      "currency": "currency.gem",
      "price": 100,
      "listed": true
    }
  },
  {
    "id": "equip.book_251",
    "name": "equip.book_251.name",
    "slot": "support",
    "icon": "icon:item/book_251",
    "stats": {
      "effectHit": 330,
      "attack": 230
    },
    "shop": {
      "currency": "currency.gem",
      "price": 100,
      "listed": true
    }
  },
  {
    "id": "equip.book_252",
    "name": "equip.book_252.name",
    "slot": "support",
    "icon": "icon:item/book_252",
    "stats": {
      "effectHit": 340,
      "attack": 240
    },
    "shop": {
      "currency": "currency.gem",
      "price": 100,
      "listed": true
    }
  },
  {
    "id": "equip.book_263",
    "name": "equip.book_263.name",
    "slot": "support",
    "icon": "icon:item/book_263",
    "stats": {
      "effectHit": 350,
      "attack": 250,
      "critRate": 240
    },
    "shop": {
      "currency": "currency.gem",
      "price": 100,
      "listed": true
    }
  },
  {
    "id": "equip.book_264",
    "name": "equip.book_264.name",
    "slot": "support",
    "icon": "icon:item/book_264",
    "stats": {
      "effectHit": 360,
      "attack": 260
    },
    "shop": {
      "currency": "currency.gem",
      "price": 100,
      "listed": true
    }
  },
  {
    "id": "equip.book_265",
    "name": "equip.book_265.name",
    "slot": "support",
    "icon": "icon:item/book_265",
    "stats": {
      "effectHit": 370,
      "attack": 270,
      "critRate": 260
    },
    "shop": {
      "currency": "currency.gem",
      "price": 100,
      "listed": true
    }
  },
  {
    "id": "equip.book_266",
    "name": "equip.book_266.name",
    "slot": "support",
    "icon": "icon:item/book_266",
    "stats": {
      "effectHit": 380,
      "attack": 280
    },
    "shop": {
      "currency": "currency.gem",
      "price": 100,
      "listed": true
    }
  },
  {
    "id": "equip.book_267",
    "name": "equip.book_267.name",
    "slot": "support",
    "icon": "icon:item/book_267",
    "stats": {
      "effectHit": 390,
      "attack": 290,
      "critRate": 280
    },
    "shop": {
      "currency": "currency.gem",
      "price": 100,
      "listed": true
    }
  }
]
